{
  "metadata": {
    "title": "EU Data Sovereignty and Residency Compliance Analysis",
    "version": "1.0.0",
    "lastUpdated": "2026-02-18",
    "analyst": "Research Team",
    "scope": {
      "jurisdictions": ["EU", "FR", "DE", "UK", "KSA"],
      "regulations": ["FR-SECNUMCLOUD-3.2", "EU-NIS2", "EU-DORA", "EU-GDPR", "EU-SCHREMS-II", "EU-DATA-ACT", "DE-C5"],
      "timeframe": "2024-2027"
    }
  },
  "regulatoryContext": {
    "overview": "The European cloud compliance landscape has undergone a fundamental transformation driven by concerns over US extraterritorial data access laws, particularly the CLOUD Act. Following the Schrems II ruling in 2020, EU organizations face increasing pressure to ensure their data remains protected from foreign government access. France has responded with the most stringent requirements through SecNumCloud 3.2, which effectively bans US hyperscalers from handling government and essential entity data. This has created a tiered compliance landscape where different market segments face vastly different requirements and solution options.",
    "keyDrivers": [
      {
        "id": "CLOUD-ACT",
        "name": "US CLOUD Act (2018)",
        "type": "legislation",
        "jurisdiction": "US",
        "description": "Clarifying Lawful Overseas Use of Data Act requires US-based companies to provide data stored on their servers regardless of location when served with a valid warrant.",
        "impact": "US hyperscalers (AWS, Azure, Google) cannot guarantee immunity from US government data requests, even for data stored in EU data centers. This creates a fundamental conflict with EU data protection requirements.",
        "effectiveDate": "2018-03-23",
        "relatedRegulationIds": ["EU-SCHREMS-II", "FR-SECNUMCLOUD-3.2"]
      },
      {
        "id": "SCHREMS-II",
        "name": "Schrems II Ruling (Court of Justice of the European Union)",
        "type": "court-ruling",
        "jurisdiction": "EU",
        "description": "The CJEU (Court of Justice of the European Union) invalidated Privacy Shield and established that US surveillance laws (FISA 702, EO 12333) do not provide adequate protection for EU personal data.",
        "impact": "Organizations must conduct Transfer Impact Assessments and implement supplementary measures for US data transfers. Standard Contractual Clauses alone are insufficient for US transfers.",
        "effectiveDate": "2020-07-16",
        "relatedRegulationIds": ["EU-GDPR"]
      },
      {
        "id": "SECNUMCLOUD-REVISION",
        "name": "SecNumCloud 3.2 Requirements",
        "type": "standard",
        "jurisdiction": "FR",
        "description": "ANSSI's updated cloud security certification with the 24/39 ownership rule requiring EU majority ownership and immunity from extraterritorial laws.",
        "impact": "US hyperscalers cannot achieve SecNumCloud certification due to ownership structure and CLOUD Act exposure. French government contracts require SecNumCloud-certified providers.",
        "effectiveDate": "2022-03-01",
        "relatedRegulationIds": ["FR-SECNUMCLOUD-3.2"]
      },
      {
        "id": "NIS2-DIRECTIVE",
        "name": "NIS2 Directive",
        "type": "legislation",
        "jurisdiction": "EU",
        "description": "Network and Information Security Directive 2 expands cybersecurity requirements to essential and important entities with supply chain security obligations.",
        "impact": "Organizations must assess ICT supply chain risks and may need to reconsider cloud provider choices based on sovereignty concerns.",
        "effectiveDate": "2024-10-18",
        "relatedRegulationIds": ["EU-NIS2"]
      },
      {
        "id": "DORA",
        "name": "Digital Operational Resilience Act",
        "type": "legislation",
        "jurisdiction": "EU",
        "description": "Requires financial entities to manage ICT third-party risk and addresses concentration risk from reliance on a small number of critical ICT providers.",
        "impact": "Financial institutions may need multi-cloud strategies and must carefully assess cloud provider risks. Critical ICT providers face direct EU regulatory oversight.",
        "effectiveDate": "2025-01-17",
        "relatedRegulationIds": ["EU-DORA"]
      }
    ],
    "timeline": [
      {
        "date": "2018-03",
        "event": "US CLOUD Act enacted",
        "impact": "Established US government's extraterritorial data access authority",
        "type": "legislation"
      },
      {
        "date": "2020-07",
        "event": "Court of Justice of the European Union (CJEU) Schrems II ruling invalidates Privacy Shield",
        "impact": "Created legal uncertainty for EU-US data transfers; SCCs require supplementary measures",
        "type": "court-ruling"
      },
      {
        "date": "2022-03",
        "event": "ANSSI publishes SecNumCloud 3.2 with ownership requirements",
        "impact": "Effectively excludes US hyperscalers from French government cloud market",
        "type": "certification"
      },
      {
        "date": "2023-01",
        "event": "Microsoft announces Bleu joint venture with Orange/Capgemini",
        "impact": "First major hyperscaler attempt to achieve SecNumCloud via partnership",
        "type": "market"
      },
      {
        "date": "2023-06",
        "event": "Google announces S3NS joint venture with Thales",
        "impact": "Second major hyperscaler partnership targeting SecNumCloud certification",
        "type": "market"
      },
      {
        "date": "2024-10",
        "event": "NIS2 Directive becomes enforceable",
        "impact": "Essential and important entities must comply with supply chain security requirements",
        "type": "legislation"
      },
      {
        "date": "2025-01",
        "event": "DORA becomes applicable",
        "impact": "Financial entities must comply with ICT third-party risk management requirements",
        "type": "legislation"
      },
      {
        "date": "2025-09",
        "event": "EU Data Act becomes applicable",
        "impact": "Cloud switching rights and data portability requirements take effect",
        "type": "legislation"
      },
      {
        "date": "2026-H2",
        "event": "Bleu expected to achieve SecNumCloud certification",
        "impact": "Microsoft technology may become available for French government workloads",
        "type": "certification"
      },
      {
        "date": "2027",
        "event": "S3NS expected to achieve SecNumCloud certification",
        "impact": "Google technology may become available for French government workloads",
        "type": "certification"
      }
    ],
    "threatLandscape": {
      "extraterritorialLaws": [
        {
          "id": "US-CLOUD-ACT",
          "name": "US CLOUD Act",
          "jurisdiction": "US",
          "description": "Allows US government to compel US-headquartered companies to provide data regardless of storage location",
          "scope": "All US-headquartered companies and their foreign subsidiaries",
          "dataAccessPowers": "Enables warrants for data stored anywhere in the world by US companies",
          "conflictWithEU": "Directly conflicts with GDPR Article 48 prohibition on data transfers based on foreign court judgments"
        },
        {
          "id": "US-FISA-702",
          "name": "FISA Section 702",
          "jurisdiction": "US",
          "description": "Allows warrantless surveillance of non-US persons' communications when at least one party is outside the US",
          "scope": "Electronic communications service providers",
          "dataAccessPowers": "Bulk collection of foreign intelligence without individual warrants",
          "conflictWithEU": "No independent judicial oversight; cited in Schrems II as failing EU adequacy standards"
        },
        {
          "id": "CN-DATA-SECURITY-LAW",
          "name": "China Data Security Law",
          "jurisdiction": "CN",
          "description": "Requires data localization and government access for national security purposes",
          "scope": "All organizations handling data in China",
          "dataAccessPowers": "Government may require data access for national security reviews",
          "conflictWithEU": "Broad government access powers conflict with EU data protection principles"
        }
      ],
      "dataSovereigntyConcerns": [
        "US government access to EU citizen data stored by US cloud providers",
        "Inability to guarantee data residency when using US-controlled infrastructure",
        "Supply chain dependencies on non-EU technology providers",
        "Concentration risk from reliance on three major US hyperscalers",
        "Lack of EU alternatives for advanced cloud services (AI, analytics)"
      ],
      "geopoliticalRisks": [
        "Escalating US-EU technology tensions",
        "Potential for US sanctions affecting cloud service access",
        "Strategic autonomy concerns in critical infrastructure",
        "Post-Brexit UK adequacy decision uncertainty",
        "Middle East data localization requirements (KSA, UAE)"
      ]
    }
  },
  "marketSegments": [
    {
      "id": "commercial",
      "name": "Commercial Enterprises",
      "type": "commercial",
      "description": "General commercial companies operating in EMEA without sector-specific regulatory requirements. Subject to GDPR, NIS2 (if important entity), and general data protection requirements.",
      "industries": ["retail", "manufacturing", "technology", "media", "professional-services", "hospitality"],
      "jurisdictions": ["EU", "UK", "FR", "DE"],
      "riskLevel": "medium",
      "complianceRequirements": {
        "mustHave": [
          {
            "id": "REQ-GDPR-DPA",
            "name": "GDPR Data Processing Agreement",
            "description": "Valid DPA with Article 28 provisions",
            "controlIds": ["CTL-GDPR-001", "CTL-CONTRACT-003"],
            "regulationIds": ["EU-GDPR"],